{
  "event_id": "evt_example_001",
  "event_type": "created",
  "tenant_id": "personal-example",
  "source_type": "web",
  "source_id": "page-001",
  "source_version": "1",
  "source_url": "https://example.invalid/page-001",
  "title": "Example source",
  "body": "Hydrated source text.",
  "acl": [
    {
      "principal_type": "user",
      "principal_id": "user-example",
      "permission": "read"
    }
  ],
  "hydration": {
    "hydrated_at": "2026-09-01T00:00:00Z",
    "method": "manual",
    "quality": "original"
  },
  "evidence_boundary": {
    "proves": ["The source contained this text at version 1."],
    "does_not_prove": ["The source claim is correct."]
  },
  "knowledge_candidates": [
    {
      "memory_type": "fact",
      "topic_key": "example/source-fact",
      "claim_key": "example/source-fact",
      "page_id": "example-source-fact",
      "title": "Example source fact",
      "summary": "A reusable claim extracted during hydration.",
      "valid_from": "2026-09-01T00:00:00Z",
      "replacement_markdown": "---\nid: example-source-fact\ntype: wiki\nstatus: active\n---\n\n# Example source fact\n\nA reusable claim extracted during hydration.\n",
      "permission_scope": "user-example",
      "confidence": "medium",
      "evidence": ["evt_example_001"]
    }
  ]
}
